{
  "book_id": "stress-latin-001",
  "title": "The City That Remembered Everything",
  "author": "Alex Morgan",
  "hook": "Every street remembers your last mistake. One person has learned how to erase it.",
  "cta": "Read the first chapter",
  "eyebrow": "NEW FICTION",
  "brand": "BOOK DROP",
  "cover_url": "./cover-demo.svg",
  "accent": "#2f6bff",
  "background": "#f4f1e8",
  "ink": "#101114"
}
