{
  "book_id": "stress-long-001",
  "title": "Невероятно длинное название книги о городе, который помнил абсолютно всё",
  "author": "Александра Константиновна Воскресенская",
  "hook": "Что произойдёт, если единственный человек, способный забывать, внезапно станет самым опасным свидетелем в городе, где каждая память хранится навсегда?",
  "cta": "Читать первую главу",
  "eyebrow": "ФАНТАСТИКА · НОВИНКА",
  "brand": "BOOK DROP",
  "cover_url": "./cover-demo.svg",
  "accent": "#ff4b2b",
  "background": "#f2eadf",
  "ink": "#111111"
}
